{
  "as_of": "2026-05-29",
  "ticker": "MSFT",
  "schema_version": "v13_single_ticker_statistical_context_envelope",
  "model_stack_version": "yearline_universe_v13.1",
  "adapter_version": "v13_8_yearline_context_adapter_v1",
  "repair_active": true,
  "distance_to_ma250_pct": -2.967,
  "required_rebound_to_ma250_pct": 3.0578,
  "post_confirmation_trend_state": null,
  "p_retry": {
    "10": 0.54,
    "20": 0.6477,
    "40": 0.8941,
    "60": 0.936
  },
  "p_retry_basis": "blend",
  "gate_passed": {
    "10": true,
    "20": true,
    "40": true,
    "60": true
  },
  "days_to_touch_central": 0.0,
  "days_to_touch_low": 0.0,
  "days_to_touch_high": 35.18,
  "p_success": 0.1369,
  "success_gate_passed": true,
  "p_successful_reclaim": {
    "10": 0.0739,
    "20": 0.0887,
    "40": 0.1224,
    "60": 0.1281
  },
  "reference_scope": "group_transition_state",
  "is_stale": false,
  "must_not_auto_execute": true
}